{
  "schemaVersion": 1,
  "policyVersion": "loot-policy-v1",
  "campaignId": "beneath-brymassen",
  "campaignScale": "short",
  "nativeRuleset": "Basic Fantasy Role-Playing Game",
  "status": "verified",
  "coverage": {
    "sourceLootPresent": true,
    "sourceLootPreserved": true,
    "tangibleRewardBeats": 6,
    "usefulRewardBeats": 5,
    "signatureRewardBeats": 3,
    "sourceEvidence": ["items-rewards.md", "dmos-template.json", "sources.md"],
    "examples": ["hidden-shrine key and healing chalice", "Room 3 Potion of Healing", "Room 10 source-random magic/treasure outcomes", "Room 11 Medallion of ESP", "Room 13 Rings of Protection and Fire Resistance", "Room 14 variant-specific coin and surface rewards"]
  },
  "supplemental": {
    "enabled": false,
    "mode": "none",
    "provenance": "source",
    "rulesAdapterRequired": false,
    "compendiumUse": "disabled",
    "antiFarmPersistent": true,
    "rerollOnReload": false,
    "artifactsRandomlyAllowed": false,
    "notes": ["The source already includes multiple magic items, random catacomb outcomes, carried treasure and quest rewards; do not add generic extra drops."]
  },
  "placementPolicy": {
    "intelligentEnemiesMayCarryLoot": true,
    "ordinaryBeastsHavePocketLoot": false,
    "undeadMayRetainPossessions": true,
    "constructsMayYieldSalvage": true,
    "hiddenCachesAllowed": true,
    "namedEnemiesPreferDistinctivePossession": true
  },
  "approval": {"passesLootGate": true, "blockers": []}
}