{
  "schemaVersion": 1,
  "policyVersion": "loot-policy-v1",
  "campaignId": "born-into-black-nights",
  "campaignScale": "short",
  "nativeRuleset": "Cairn",
  "status": "verified",
  "coverage": {
    "sourceLootPresent": true,
    "sourceLootPreserved": true,
    "tangibleRewardBeats": 7,
    "usefulRewardBeats": 5,
    "signatureRewardBeats": 2,
    "sourceEvidence": ["items-rewards.md", "dmos-template.json", "sources.md"],
    "examples": ["Bertram's ring and journal", "holy water and silver incense burner", "historical tapestry", "Rod of the Fisher Folk and plant-control spellbook", "hidden precious-stone cache", "random Cairn spellbook and magical arrows", "surviving shield"]
  },
  "supplemental": {
    "enabled": false,
    "mode": "none",
    "provenance": "source",
    "rulesAdapterRequired": false,
    "compendiumUse": "disabled",
    "antiFarmPersistent": true,
    "rerollOnReload": false,
    "artifactsRandomlyAllowed": false,
    "notes": ["Room-by-room source treasure already exceeds the short-adventure minimum; retain Cairn-native mechanics."]
  },
  "placementPolicy": {
    "intelligentEnemiesMayCarryLoot": true,
    "ordinaryBeastsHavePocketLoot": false,
    "undeadMayRetainPossessions": true,
    "constructsMayYieldSalvage": true,
    "hiddenCachesAllowed": true,
    "namedEnemiesPreferDistinctivePossession": true
  },
  "approval": {"passesLootGate": true, "blockers": []}
}