{
  "schemaVersion": 1,
  "policyVersion": "loot-policy-v1",
  "campaignId": "midnight-in-bonetown",
  "campaignScale": "multi-session",
  "nativeRuleset": "Cairn",
  "status": "verified",
  "coverage": {
    "sourceLootPresent": true,
    "sourceLootPreserved": true,
    "tangibleRewardBeats": 7,
    "usefulRewardBeats": 5,
    "signatureRewardBeats": 4,
    "sourceEvidence": ["items-rewards.md", "dmos-template.json", "sources.md"],
    "examples": ["Resurrection Stones", "Gran's Flea Market relics", "Rixi gadgets", "Old Well adventurer equipment", "Red Dragon hoard", "Dim Warrens tomb magic items", "Quackolocation spell reward"]
  },
  "supplemental": {
    "enabled": false,
    "mode": "none",
    "provenance": "source",
    "rulesAdapterRequired": false,
    "compendiumUse": "disabled",
    "antiFarmPersistent": true,
    "rerollOnReload": false,
    "artifactsRandomlyAllowed": false,
    "notes": ["Source loot is already unusually rich; do not dilute Cairn-specific items with generic 5e compendium drops."]
  },
  "placementPolicy": {
    "intelligentEnemiesMayCarryLoot": true,
    "ordinaryBeastsHavePocketLoot": false,
    "undeadMayRetainPossessions": true,
    "constructsMayYieldSalvage": true,
    "hiddenCachesAllowed": true,
    "namedEnemiesPreferDistinctivePossession": true
  },
  "approval": {"passesLootGate": true, "blockers": []}
}